{
  "$schema": "https://json-schema.org/draft/2020-12/schema",
  "$id": "https://github.com/guidobuilds/loopback/blob/main/loopback/core/feedback-record.schema.json",
  "title": "Feedback Record",
  "description": "The single wire contract for a loopback record (design §5). De-identified by construction: no raw artifact/output content is carried, only the synthesized lesson (summary) plus a minimal redacted excerpt. Reused by the client core (ajv) and the central FastAPI service (pydantic).",
  "type": "object",
  "additionalProperties": false,
  "required": ["id", "schemaVersion", "artifact", "summary"],
  "properties": {
    "id": {
      "type": "string",
      "minLength": 1,
      "description": "Feedback record id — primary key assigned by the central DB."
    },
    "schemaVersion": {
      "type": "integer",
      "const": 1,
      "description": "Wire-contract version. Currently 1."
    },
    "artifact": {
      "type": "object",
      "description": "The skill/agent/artifact the feedback is about; closes the attribution gap.",
      "additionalProperties": false,
      "required": ["kind"],
      "properties": {
        "kind": {
          "type": "string",
          "enum": ["skill", "agent", "artifact"],
          "description": "The kind of artifact the feedback is about."
        },
        "id": {
          "type": "string",
          "minLength": 1,
          "description": "Artifact identifier, e.g. 'prd-writer'."
        },
        "version": {
          "type": "string",
          "minLength": 1,
          "description": "Artifact version from the plugin manifest / marketplace pin, e.g. '3.2.0'."
        },
        "repo": {
          "type": "string",
          "minLength": 1,
          "description": "Optional repo where the user was working (e.g. from 'git remote get-url origin'), e.g. 'github.com/org/prd-writer'."
        }
      }
    },
    "summary": {
      "type": "string",
      "minLength": 1,
      "description": "The synthesized lesson = the feedback summary: a generalizable, de-identified statement of what went wrong and what 'correct' looks like."
    },
    "workType": {
      "type": "string",
      "minLength": 1,
      "description": "Task category, e.g. 'prd' | 'code' | 'test' | 'review' | 'prd-authoring'."
    },
    "evidenceExcerpt": {
      "type": "string",
      "description": "Minimal, redacted excerpt — exactly what the user saw in the consent gate. No raw artifact stored."
    },
    "timestamp": {
      "type": "string",
      "format": "date-time",
      "description": "When the feedback was generated (RFC 3339 / ISO 8601 date-time)."
    },
    "severity": {
      "type": "string",
      "enum": ["low", "medium", "high"],
      "description": "Defect severity."
    },
    "confidence": {
      "type": "string",
      "enum": ["low", "medium", "high"],
      "description": "Detector self-rating of its own judgment."
    },
    "clusterKey": {
      "type": "string",
      "minLength": 1,
      "description": "Client's proposed dedup key (§8), e.g. 'prd-writer:prd-authoring:wrong-template'. The server may recompute."
    },
    "client": {
      "type": "object",
      "description": "Metadata about the submitting client.",
      "additionalProperties": false,
      "required": ["plugin"],
      "properties": {
        "plugin": {
          "type": "string",
          "minLength": 1,
          "description": "Submitting plugin name@version, e.g. 'loopback@0.0.1'."
        },
        "harness": {
          "type": "string",
          "enum": ["claude-code", "opencode", "codex"],
          "description": "Which agent harness produced the feedback. Optional: omitted when unknown rather than mislabeled."
        }
      }
    }
  }
}
